id,title,overview,poster_path
103086,All For Love,"A penniless country boy goes in search of his runaway sister in Bogotá, where he falls for an aspiring singer, but gets tangled up in organized crime.",/jjmLFjKKnxyRq07lyD29wPbRM2d.jpg
43146,X-Men,"X-Men, still grieving over the death of Phoenix (Jean Grey), are investigating a case of a missing mutant girl in Northern Japan. This leads them to a mysterious virus that turns mutants into monsters. U-Men and the Inner Circle want it.",/eMQcgexc7bbbXsL0tNsNtLNPo56.jpg
4575,Lizzie McGuire,"Lizzie McGuire is all about the ordinary and not-so-ordinary adventures of a junior high student and her two best friends as they try to deal with the ups and downs of school, popularity, boys, parents, a bratty little brother--just life in general. And if Lizzie leaves anything unsaid, you can bet that her cartoon alter ego will say it for her!",/vaaF94ogtMCPnFNyX7YUo9Ebfc8.jpg
1931,Disney's Adventures of the Gummi Bears,"Join the world’s sweetest heroes for high adventure in a mystical land of giants and wizards, ogres and dragons, and wondrous creatures both good and evil. Meet Gruffi, Zummi, Cubbi, Grammi, Tummi, Sunni, and all the legendary Gummis as they laugh, play, foil dastardly plots, and fight for what's right.",/7Jv2GYLWywjExyG39RNkqpfgjrv.jpg
61838,Barbie: Life in the Dreamhouse,"The series is set as a reality TV-esque show following Barbie, her sisters and her friends in the day-to-day activities that take place in the Dreamhouse and surrounding areas. Much of the humor in the show derives from parodying and lampooning both the traditional reality TV format and the Barbie franchise itself.",/A7VrXi3RD8vhV1sjGcPHNepMz4T.jpg
2406,Crossing Jordan,"Crossing Jordan is an American television crime/drama series that stars Jill Hennessy as Jordan Cavanaugh, M.D., a crime-solving forensic pathologist employed in the Massachusetts Office of the Chief Medical Examiner.",/bywFoHoLZvW2vxDc7n4ToAKkR0y.jpg
7821,El Chavo: The Animated Series,"El Chavo Animado is a Mexican animated series based on a live-action TV series of the same name, created by Roberto Gómez Bolaños.",/fIQpvawxgajLhjZfN7XS0stzesJ.jpg
7704,Legend of the Seeker,"The adventures of woodsman Richard Cypher, who discovers that he was born to fulfill a prophecy of becoming a guardian hero to oppressed people. With the help of a mysterious woman named Kahlan and a wise old wizard named Zedd, he must stop a ruthless and bloodthirsty tyrant from unleashing an ancient evil and enslaving the world.",/ibclBUwEjsvfi8hpdO2i9jdOMUI.jpg
39279,Hart of Dixie,"New Yorker Zoe Hart has it all figured out - after graduating top of her class from medical school, she'll follow in her father's footsteps and become a cardio-thoracic surgeon. But when her dreams fall apart, Zoe decides to work at a small practice in Bluebell, Alabama.",/zMRdFWwcEL87VVmKqGzusLWBMqd.jpg
2692,My Wife and Kids,"Michael Kyle is a loving husband and modern-day patriarch who rules his household with a unique and distinct parenting style. As he teaches his three children some of life's lessons, he does so with his own brand of humor.",/eyQsN8bU27fdIs2D66gFmcIo0dM.jpg
2243,Touched by an Angel,"Monica, an angel, is tasked with bringing guidance and messages from God to various people who are at a crossroads in their lives.",/jiSv0xNx6MGhAFfv05Ov7DgDELJ.jpg
92209,Truth Seekers,"A ghost-hunting duo team up to uncover and film paranormal sightings across the U.K. and share their adventures on an online channel. Their supernatural experiences grow more frequent, terrifying, and even deadly as the pair begin to uncover a conspiracy that could threaten the entire human race.",/zRva67XCxkCRt4WuobrVVysdufU.jpg
84380,Better Than Us,"Moscow in a not so distant future where human beings share their daily lives with robots. Georgy, a forensic who has a robot assistant, suddenly finds himself caught up in the first murder committed by a new kind of experimental humanoid.",/dUigUEoz7IlImY4uJLtqnLRYEU3.jpg
78314,Tres milagros,"The series follows the lives of three young people who end up joining their destinies thanks to a prophecy, the prophecy says: ""The day that Milagros meets Milagros and Milagros, Milagros and the love of Milagros, They will die"". On September 18, 1985 there is a birth of three girls who are baptized with the same name. Catemaco's jaguar manages to see the connection between the three girls. and to his own sorrow he anticipates a prophecy. What will make the three girls start their lives and both fall in love with the same man, but only one of them will die.",/dE3k1uOAncEdaIA6Gtx82JFzI3p.jpg
73640,La esclava blanca,,/8U3UoUfK5WXOpzB0gfE6nHSoglw.jpg
111743,Love & Anarchy,A married consultant and a young IT tech kick off a flirty game that challenges societal norms — and leads them to re-evaluate their entire lives.,/2yEY5gT1HENZ6YDxtilw7hV4Xs6.jpg
93520,Ghostwriter,"When a ghost haunts a neighborhood bookstore and starts releasing fictional characters into the real world, four kids must team up to solve an exciting mystery surrounding the ghost’s unfinished business.",/cylPAXqLws5yM9oJa47MsHItBy8.jpg
84661,The Outsider,"When an insidious supernatural force edges its way into a seemingly straightforward investigation into the gruesome murder of a young boy, it leads a seasoned cop and an unorthodox investigator to question everything they believe in.",/aMiPwPQjQI1EZN3xP2V0sSU37dc.jpg
46930,Ripper Street,"A drama set in the East End of London in 1889, during the aftermath of the ""Ripper"" murders. The action centres around the notorious H Division – the police precinct from hell – which is charged with keeping order in the chaotic streets of Whitechapel. Ripper Street explores the lives of characters trying to recover from the Ripper's legacy, from crimes that have not only irretrievably altered their lives, but the very fabric of their city. At the drama's heart our detectives try to bring a little light into the dark world they inhabit.",/6w8yKYsA7RkuyauW224kBZQebFt.jpg
44593,Pac-Man and the Ghostly Adventures,The fate of PacWorld lies with Pac and his loyal crew as they protect the Power Berries from falling into the sinister hands of Betrayus and his evil army of baddies.,/tdSMY8A4yNGPh5F7fJ9AglV1paX.jpg
19125,Killer Women,Mujeres Asesinas is a series that shows the dark side of women who have been mistreated or abused and become cruel murderers. The series shows how violence and death can overcome the feminine mind.,/v6BUGwKWyFX6DiLyVYAz680JxgE.jpg
12861,Amigas y rivales,"Amigas y rivales is a Mexican telenovela, which was produced by and broadcast on Televisa in 2001.",/l1ufpjYSfQ0yqf860oXmlIaFS1M.jpg
5451,Without Breasts There Is No Paradise,"Sin Senos no hay Paraíso is a RTI Colombia–Telemundo remake and loose adaptation of the original Colombian series Sin Tetas No Hay Paraíso. The series is based on investigative journalist Gustavo Bolivar's debut novel and features an attractive young prostitute who desires to have massive breast implants in order to attract a rich cocaine smuggler. It is also based on a true story. The series premiered on June 16, 2008;",/pSsQ5rFalyT7ehwgeSlITgBSi5S.jpg
2808,Totally Spies!,"Totally Spies! depicts three girlfriends 'with an attitude' who have to cope with their daily lives at high school as well as the unpredictable pressures of international espionage. They confront the most intimidating - and demented - of villains, each with their own special agenda for demonic, global rude behavior.",/zvEit6c2zC2PosXROb85jZwb0gx.jpg
1663,The Six Million Dollar Man,"Follow the adventures of Steve Austin, cybernetically enhanced astronaut turned secret agent, employed by the OSI, under the command of Oscar Goldman and supervised by the scientist who created his cybernetics, Rudy Wells. Steve uses the superior strength and speed provided by his bionic arm and legs, and the enhanced vision provided by his artificial eye, to fight enemy agents, aliens, mad scientists, and a wide variety of other villains.",/mEOuVUNVG5Xx4kx3XPi9XWCDWcf.jpg
114505,Pixar Popcorn,"A collection of mini shorts starring some of your favorite Pixar characters in all-new, bite size stories.",/pRpwcEKPvsj0WKbhrowQbyy4bIg.jpg
255,Hi Hi Puffy AmiYumi,"Hi Hi Puffy AmiYumi is an American-Japanese animated fantasy-comedy television series from Cartoon Network and TV Tokyo, produced by Renegade Animation and Cartoon Network Studios in Japan. The show was created by Sam Register, who also serves as the series' executive producer.

According to Register, the target audience of the show is boys and girls from six to eleven years old. However, the show also has a following of fans of the real-life Ami Onuki and Yumi Yoshimura who make up the Japanese pop duo PUFFY, known as ""Puffy AmiYumi"" in North America. Register, a fan of the band, wished to spread its fame to other parts of the world and thus produced the cartoon.

The series features the adventures of animated versions of the duo, who have been immensely popular in Japan since making their debut in 1996. The group now has its own U.S. albums, including a 2004 companion album to this program, and was known to viewers of Cartoon Network in the USA for performing the theme to the Teen Titans animated series.",/s8QFImdM6DzV9h2sOUt67NmxVzd.jpg
79026,The Protector,"The epic adventure of Hakan, a young shopkeeper whose modern world gets turned upside down when he learns he’s connected to a secret, ancient order, tasked with protecting Istanbul.",/xoN4wJRzeaWBfuQDYPngJgN6y9t.jpg
60905,Salem,"Set in the volatile world of 17th century Massachusetts, 'Salem' explores what really fueled the town's infamous witch trials and dares to uncover the dark, supernatural truth hiding behind the veil of this infamous period in American history. In Salem, witches are real, but they are not who or what they seem.",/sS9pnQSjH2COeBvhRalfyZlN4TJ.jpg
31841,Episodes,"A British husband-and-wife comedy writing team travel to Hollywood to remake their successful British TV series, with disastrous results.",/yyaU6cayJQCr555VgYYETbDHu1E.jpg
53606,Love,Rebellious Mickey and good-natured Gus navigate the thrills and agonies of modern relationships.,/wvtW9YoMkovpMqyZCWUbQC6FJlg.jpg
61387,NCIS: New Orleans,"A drama about the local field office that investigates criminal cases affecting military personnel in The Big Easy, a city known for its music, entertainment and decadence.",/1WJJUUZODmRTcFydLDBUtiztL6x.jpg
10079,Spider-Man Unlimited,Spider-Man travels to Counter-Earth to rescue a Terran shuttle crew trapped there and discovers a tyrannical & warped version of his world.,/hNdf1WmFil9IV7rabBe6PnAmYnI.jpg
4602,That's So Raven,"No ordinary teenager; Raven Baxter can see glimpses of the future! Watch her schemes and misadventures as she enlists the help of friends, including best friends Eddie and Chelsea, to change life's little outcomes. Raven's younger brother, Cory, is obsessed with money and creates get-rich-quick schemes to try to earn cash.",/eohThtvBB4i52fyXI68dkWowdGE.jpg
104819,La Jauría,"Blanca, student leader of the feminist movement in an occupied school, goes missing: hours later, a video of a group raping the girl goes viral. In their aim to find her, a police squad formed by three women puts their lives and that of their families at risk. As they look for Blanca and investigate, they will find out that behind this gender crime there is much more than just one offender.",/siTwS1bBCzFFzjBEyoZg51jsfmv.jpg
384,Doug,"Doug Funnie experiences common predicaments while attending school in his new hometown of Bluffington, Virginia.",/fEzGDVHsUlOhU59EKSePobldyIf.jpg
127635,Marvel's Spidey and His Amazing Friends,"Follow Peter Parker, Gwen Stacy and Miles Morales and their adventures as the young heroes team up with Hulk, Ms. Marvel and Black Panther to defeat foes like Rhino, Doc Ock and Green Goblin and learn that teamwork is the best way to save the day.",/dA4S18rnLx4sWW8agmLLKUvRM7n.jpg
95515,Outbreak,"A dangerous virus appears in a group of homeless people, causing a risk of outbreak. How long will it take Anne-Marie Leclerc, director of the Emergency Public Health Laboratory, to realize that an actual epidemic is starting to take shape?",/dwfYZrGs898pSfMU3IxR4fim3Nu.jpg
94423,Japan Sinks: 2020,"Based on Sakyo Komatsu's 1973 bestseller sci-fi novel ""Japan Sinks."" The story is set right after the 2020 Tokyo Summer Olympics, and follows the fate of the four members of the Muto family, including the protagonist girl Ayumu and her younger brother Gou.",/guWqteZJ16ABGGtXIKFyDBAo8Ik.jpg
15655,Knight Rider,"On the heels of NBC's hit movie, the iconic 1980s television classic  comes roaring back to life as a reinvented, updated and super-charged  action series showcasing the new KITT (Knight Industries Three  Thousand). Absolutely the coolest car ever created, KITT is equipped  with an ""AI"" (artificial intelligence) that is capable of hacking almost  any system. Its weapons systems match that of a jet fighter, and its  body is capable of actually transforming into other vehicles and using  sophisticated holographic imagery to elude villains.",/e93H0P6GYoDUhHR5uCdmfLDAvKt.jpg
45,Top Gear,"This fast-paced and stunt-filled motor show tests whether cars, both mundane and extraordinary, live up to their manufacturers' claims. The long-running show travels to locations around the world, performing extreme stunts and challenges to see what the featured cars are capable of doing. The current hosts are Paddy Mcguinness, Chris Harris and Andrew ""Freddie"" Flintoff.",/aqM6QnuhSXzjHlKbXyKUqxaGiWu.jpg
90180,Jezabel,"The story of Phoenician princess Jezebel, an idol worshipper who marries King Ahab and uses her beauty and wickedness to try to impose on the Israelite people the worship of her pagan gods.",/m5Dh1RXQaDKZd2J0wYjZ3mhQZNo.jpg
12577,Devil May Cry,The adventures of the demon hunter Dante who himself is half demon and half human.,/xDGxMQk24gt4proydCyxddPzTIG.jpg
90855,SAINT SEIYA: Knights of the Zodiac,"Seiya and the Knights of the Zodiac rise again to protect the reincarnation of the goddess Athena, but a dark prophecy hangs over them all.",/il9scUkw3q8bs1HGFotJhcPNo1J.jpg
61698,Galavant,"Once upon a time, the dashing hero, Prince Galavant lost the love of his life, Madalena, to the evil King Richard. Now, our fallen hero is ready to take revenge and restore his “happily ever after.” But it won't be without a few twists and turns along the way in this fairytale musical.",/oEjOZARPBOcffGohXdhm3MAtgB3.jpg
64433,Shades of Blue,"Sexy New York detective and single mother Harlee Santos fell in with a tight-knit group of dirty cops, taking bribes and protection money that she uses to provide the best life for her honest, talented daughter. But when she's trapped by the FBI and forced to inform on her own ""brothers,"" she'll have to walk the fine line between love, loyalty, honor and betrayal, and try to keep it together for her daughter's future.",/kSCnmyWycGsxu8BgSoyM8GYsZck.jpg
2355,Lilo & Stitch: The Series,"Lilo & Stitch: The Series is the animated television spinoff of the feature film, Lilo & Stitch and the follow-up to Stitch! The Movie. It was aired on Disney Channel worldwide, but has only been released on DVD in Japan, in four box sets.",/hmNpwSKZzStqO4bfOFeYNTn2B7.jpg
94951,Mythic Quest,"Meet the team behind the biggest multiplayer video game of all time. But in a workplace focused on building worlds, molding heroes, and creating legends, the most hard-fought battles don’t occur in the game—they happen in the office.",/z5yMKsYccNG6CDvPFgfWOVavoc9.jpg
82816,Lovecraft Country,"The anthology horror series follows 25-year-old Atticus Freeman, who joins up with his friend Letitia and his Uncle George to embark on a road trip across 1950s Jim Crow America to find his missing father. They must survive and overcome both the racist terrors of white America and the malevolent spirits that could be ripped from a Lovecraft paperback.",/fz7bdjxPColvEWCGr5Kiclzc86d.jpg
15830,Get Smart,"Get Smart is a short-lived American comedy television series that aired in 1995 on FOX. The series was a sequel to the original Get Smart television series that ran from 1965 to 1970. The series premiered on January 8, 1995 and ended its original run on February 19, 1995.",/cuVYMvDExkD4TYz2qsAKFEo6AWx.jpg
985,Wacky Races,"Wacky Races is an American animated television series produced by Hanna-Barbera. The series, inspired by the 1965 slapstick comedy film The Great Race, features 11 different cars racing against each other in various road rallies throughout North America, with each driver hoping to win the title of the ""World's Wackiest Racer."" Wacky Races ran on CBS from September 14, 1968, to January 4, 1969. Seventeen episodes were produced, with each episode featuring two different races.

The cartoon had an unusually large number of regular characters, with twenty-three people and animals spread among the 11 race cars. Reruns of the series currently air several times a day on Cartoon Network's classic animation network Boomerang.",/tByRhftDhdleVkxvwir08dlaHBF.jpg
75666,McMafia,"Alex Godman, the English-raised son of Russian mafia exiles, has spent his life trying to escape the shadow of their past, building his own legitimate business and forging a life with his girlfriend Rebecca. But when a murder forces his family's past to return to threaten them, Alex is drawn into the criminal underworld and must confront his values to protect those he loves.",/jdt7RFfVCGWrNnrxeQ0Us9kGhJu.jpg
66871,SIX,Action drama series inspired by the real missions of Navy SEAL Team Six.,/doqvfJojBwtprn3qPxb4ndO3lom.jpg
97861,Night on Earth,"This nature series’ new technology lifts night’s veil to reveal the hidden lives of the world’s creatures, from lions on the hunt to bats on the wing.",/g6POM3aV8iKvxvd0DBs9nBYwMX4.jpg
62643,DC's Legends of Tomorrow,"When heroes alone are not enough ... the world needs legends. Having seen the future, one he will desperately try to prevent from happening, time-traveling rogue Rip Hunter is tasked with assembling a disparate group of both heroes and villains to confront an unstoppable threat — one in which not only is the planet at stake, but all of time itself. Can this ragtag team defeat an immortal threat unlike anything they have ever known?",/AcEFDh272YVTR6B6zrrusk8BjJG.jpg
39793,Call the Midwife,"Drama following the lives of a group of midwives working in the poverty-stricken East End of London during the 1950s, based on the best-selling memoirs of Jennifer Worth.",/b1p0nL00x563ACkcmGNIRP4ZnkA.jpg
12727,Cómplices Al Rescate,Cómplices al Rescate is a Mexican telenovela starring Belinda as two twins who were separated at birth.,/zeZqJ3bSP0ScptNsS5v6EMeL1Ec.jpg
1706,The Pretender,"Raised in a secret facility built for experimenting on children, Jarod is a genius who can master any profession and become anyone he has to be. When he realizes as an adult that he's actually a prisoner and his captors are not as benevolent as he's been told, he breaks out. While trying to find his real identity, Jarod helps those he encounters and tries to avoid the woman sent to retrieve him.",/76q5tPOPQkQYIuZu2SG6viZcp2b.jpg
31078,Bored to Death,"Jonathan Ames, a young Brooklyn writer, is feeling lost. He's just gone through a painful break-up, thanks in part to his drinking, can't write his second novel, and carouses too much with his magazine editor. Rather than face reality, Jonathan turns instead to his fantasies — moonlighting as a private detective — because he wants to be a hero and a man of action.",/eCHirPRvImk6wTLJMKI8vVNVcOT.jpg
62688,Supergirl,"Twenty-four-year-old Kara Zor-El, who was taken in by the Danvers family when she was 13 after being sent away from Krypton, must learn to embrace her powers after previously hiding them. The Danvers teach her to be careful with her powers, until she has to reveal them during an unexpected disaster, setting her on her journey of heroism.",/zsaiq8ZclPuneuN7loLEbsh1ANJ.jpg
85948,Star Trek: Lower Decks,"The lives of the support crew serving on one of Starfleet's least important ships, the U.S.S. Cerritos, in 2380. Ensigns Mariner, Boimler, Rutherford and Tendi have to keep up with their duties and their social lives, often while the ship is being rocked by a multitude of sci-fi anomalies.",/vf3E86GYhx40DuDvmKtFiX1qWPb.jpg
70798,Istanbullu Gelin,Faruk is the owner of a bus company and the leader of a powerful family in Bursa which is a metropol in Turkey. Faruk meets a violonist girl and falls in love with her. But the dominant mother of Faruk isn't happy with her son's relationship.,/jGE1pj8ixURdSi1Qqf6FJM5Yqmi.jpg
62745,Is It Wrong to Try to Pick Up Girls in a Dungeon?,"In a world, where the deities have descended from the heavens lies the town of Orario that features the Dungeon, which contains an assortment of monsters from goblins to dragons. Adventurers slay those monsters and take their shards, which are then used to craft magic items. To become an adventurer, people join groups called Familia. Each of which is named after and serves a resident deity. The adventurers and their attributes and abilities are ranked by level, improved by experience and supervised by their Familia's deity.

Bell Cranel, a novice adventurer, is the sole member of the Familia under the goddess Hestia. After being saved by top level adventurer Ais Wallenstein of the Loki Familia, he falls in love with her and decides to improve and become worthy of her attention. All the while mostly unaware that other girls, deities and mortals, also develop feelings for him. Especially Hestia herself.",/hR4zYTRJZiSYooocDRPW7P3PCTF.jpg
96481,Rise of Empires: Ottoman,Ottoman Sultan Mehmed II wages an epic campaign to take the Byzantine capital of Constantinople and shapes the course of history for centuries.,/nkvdPFYo7o2IQWooJvA9UE0nvAp.jpg
62710,Blindspot,"A vast international plot explodes when a beautiful Jane Doe is discovered naked in Times Square, completely covered in mysterious, intricate tattoos with no memory of who she is or how she got there. But there's one tattoo that is impossible to miss: the name of FBI agent Kurt Weller, emblazoned across her back. ""Jane,"" Agent Weller and the rest of the FBI quickly realize that each mark on her body is a crime to solve, leading them closer to the truth about her identity and the mysteries to be revealed.",/4AeYzamQmd9Fa6hawDmYKbdvBSe.jpg
127235,Invasion,Earth is visited by an alien species that threatens humanity’s existence. Events unfold in real time through the eyes of five ordinary people across the globe as they struggle to make sense of the chaos unraveling around them.,/7rpiHZx10Nm50AtzTUEO9eyaKdq.jpg
82875,Origin,"A group of troubled passengers wake up on a damaged spaceship abandoned in deep space, each having left behind a dark past in search of a fresh start on a newly colonized planet. As their terrifying situation spirals into paranoia, they come to realize that the greatest threat to their dream of starting over – and indeed their lives – is something far darker than the pasts they were so desperate to escape.",/h01iyro5u51wr2e6bXadHjmQ5Dd.jpg
60556,Bitten,"Elena Micheals thought she left the world of supernatural behind when she left Stonehaven behind 'for good this time' she thought. Until the night she got the mysterious call from her pack leader asking her to come back. So now she is heading back, leaving her life as a normal photographer in Toronto for the moment to re-enter the world of werewolves, rules about protect the pack and a man she has spent years trying to get out of her system. Oh and did she mention she was the only living female werewolf in existence?",/guhxl5I8J1WVEA3yeDt8hwgpYWx.jpg
95612,Home for Christmas,"Tired of the constant comments on her relationship status, perpetually single Johanne starts a 24-day hunt for a boyfriend to bring home for Christmas.",/9ISBql67OPMVZtTt5ZBWD3FBQpG.jpg
81747,Tell Me a Story,The world's most beloved fairy tales reimagined as a dark and twisted psychological thriller.,/56aw0q12N8ujbcEdCXaLZMfAYXd.jpg
1940,Entourage,Film star Vince Chase navigates the vapid terrain of Los Angeles with a close circle of friends and his trusty agent.,/siVOE6ZYzFQfVY7j0hakoqzr8Yf.jpg
75663,Deadly Class,"Follow a disillusioned teen recruited into a storied high school for assassins. Maintaining his moral code while surviving a ruthless curriculum, vicious social cliques, and his own adolescent uncertainties may prove fatal.",/u2GSiPazSXpyNQz0yymOUCUm944.jpg
43899,The Bible,The story of God's creation of the Earth and the landmark events leading up to the Crucifixion of Jesus Christ.,/cqGupIDrTHosdGTm5N0V4qMrZyf.jpg
42368,Lilyhammer,"After Frank The Fixer Tagliano testifies against his Mafia boss in New York, he enters the Witness Protection Program and makes an unusual demand: he wants to be set up with a new life in the Norwegian small town of Lillehammer or as he calls it, Lilyhammer.",/o5I2D5oeIEafpyFw30v11AwkhnB.jpg
5148,Stargate Universe,"The adventures of a present-day, multinational exploration team traveling on the Ancient spaceship Destiny many billions of light years distant from the Milky Way Galaxy. They evacuated there and are now trying to figure out a way to return to Earth, while simultaneously trying to explore and to survive in their unknown area of the universe.",/n23WMoa9y5TYPuKSQjPArpbHr9x.jpg
61986,Bloodline,"A dramatic thriller that explores the demons lurking beneath the surface of a contemporary American family. The Rayburns are hard-working pillars of their Florida Keys community. But when the black sheep son comes home for the 45th anniversary of his parents' hotel, he threatens to expose the Rayburns' dark secrets and shameful past, pushing his siblings to the limits of family loyalty.",/qlZxERVeWhR2Vb82yKb5hp5nytY.jpg
