id,title,overview,poster_path
130392,The D'Amelio Show,"From relative obscurity and a seemingly normal life, to overnight success and thrust into the Hollywood limelight overnight, the D’Amelios are faced with new challenges and opportunities they could not have imagined.",/z0iCS5Znx7TeRwlYSd4c01Z0lFx.jpg
100,I Am Not an Animal,"I Am Not An Animal is an animated comedy series about the only six talking animals in the world, whose cosseted existence in a vivisection unit is turned upside down when they are liberated by animal rights activists.",/qG59J1Q7rpBc1dvku4azbzcqo8h.jpg
94605,Arcane,"Amid the stark discord of twin cities Piltover and Zaun, two sisters fight on rival sides of a war between magic technologies and clashing convictions.",/fqldf2t8ztc9aiwn3k6mlX3tvRT.jpg
88040,Given,"Tightly clutching his Gibson guitar, Mafuyu Satou steps out of his dark apartment to begin another day of his high school life. While taking a nap in a quiet spot on the gymnasium staircase, he has a chance encounter with fellow student Ritsuka Uenoyama, who berates him for letting his guitar's strings rust and break. Noticing Uenoyama's knowledge of the instrument, Satou pleads for him to fix it and to teach him how to play. Uenoyama eventually agrees and invites him to sit in on a jam session with his two band mates: bassist Haruki Nakayama and drummer Akihiko Kaji.",/pdDCcAq8RNSZNk81PXYoHNUPHjn.jpg
77696,Run BTS!,"Run BTS! is a South Korean show by the boy band BTS. The show is all about BTS doing activities, challenges and lots more.",/xxv8Ibs8Anni6qrWkAf60rDsPCu.jpg
83095,The Rising of the Shield Hero,"Iwatani Naofumi was summoned into a parallel world along with 3 other people to become the world's Heroes. Each of the heroes respectively equipped with their own legendary equipment when summoned, Naofumi received the Legendary Shield as his weapon. Due to Naofumi's lack of charisma and experience he's labeled as the weakest, only to end up betrayed, falsely accused, and robbed by on the third day of adventure. Shunned by everyone from the king to peasants, Naofumi's thoughts were filled with nothing but vengeance and hatred. Thus, his destiny in a parallel World begins...",/hm7AAWOMNxGzpGolgzNATgnyQbb.jpg
125910,Young Royals,"Prince Wilhelm adjusts to life at his prestigious new boarding school, Hillerska, but following his heart proves more challenging than anticipated.",/6CHznbr0BF78ar16zJwTVRYLLOX.jpg
106600,BTS In the SOOP,"'In the SOOP BTS ver.' is a reality show, portraying BTS members' everyday life, relaxation, and everything in between, away from the city life. A time of freedom and healing in a place for BTS, and BTS only.",/eBsIEKqLMtktw2jpFPa9WTuGyPN.jpg
83097,The Promised Neverland,"Surrounded by a forest and a gated entrance, the Grace Field House is inhabited by orphans happily living together as one big family, looked after by their ""Mama,"" Isabella. Although they are required to take tests daily, the children are free to spend their time as they see fit, usually playing outside, as long as they do not venture too far from the orphanage — a rule they are expected to follow no matter what. However, all good times must come to an end, as every few months, a child is adopted and sent to live with their new family... never to be heard from again.

However, the three oldest siblings have their suspicions about what is actually happening at the orphanage, and they are about to discover the cruel fate that awaits the children living at Grace Field, including the twisted nature of their beloved Mama.",/oBgRCpAbtMpk1v8wfdsIph7lPQE.jpg
110309,SK8 the Infinity,"""S"" is a dangerous, top secret, no-holds-barred downhill skateboarding race down an abandoned mine. When avid skateboarder Reki takes Langa to the mountain where ""S"" is held, Langa, who's never been on a skateboard in his life, finds himself sucked into the world of ""S"", and…?!",/ksb6QlSCsRLr3MNmxc8ojOOLK6V.jpg
65648,Maid Sama!,Misaki Ayuzawa is the first female student council president at a once all-boys school turned co-ed. She rules the school with strict discipline demeanor. But she has a secret—she works at a maid cafe due to her families circumstances. One day the popular A-student and notorious heart breaker Takumi Usui finds out her secret and makes a deal with her to keep it hush from the school in exchange for spending some time with him.,/igkn0M1bgMeATz59LShvVxZNdVd.jpg
80564,Banana Fish,"Nature made Ash Lynx beautiful; nurture made him a cold ruthless killer. A runaway brought up as the adopted heir and sex toy of ""Papa"" Dino Golzine, Ash, now at the rebellious age of seventeen, forsakes the kingdom held out by the devil who raised him. But the hideous secret that drove Ash's older brother mad in Vietnam has suddenly fallen into Papa's insatiably ambitious hands—and it's exactly the wrong time for Eiji Okamura, a pure-hearted young photographer from Japan, to make Ash Lynx's acquaintance...",/1UV5di9UIXwrpCW3xQ4RNli5hEV.jpg
123566,Metal Family,"Metal Family follows the daily lives of Glam and Victoria, two metal fans that fell in love and had two children together, Dee and Heavy.",/yovTSLBdNjXIVo8CPaPWFE5NcAw.jpg
91801,Welcome to Demon School! Iruma-kun,"Fourteen-year-old Suzuki Iruma has just been abandoned and sold to a demon by his irresponsible parents! Surprisingly, the next thing he knows he's living with the demon who has adopted him as his new grandson, and has been transferred into a school in the demon world where his new ""demon"" grandfather works as the principal. Thus begins the cowardly Iruma-kun's extraordinary school life among the otherworldly as he faces his true self, takes on challenges, and rises to become someone great.",/aed6I1EMR4Lbk8bdikWrndbn5Og.jpg
61663,Your Lie in April,"Kousei Arima was a genius pianist until his mother's sudden death took away his ability to play. Each day was dull for Kousei. But, then he meets a violinist named Kaori Miyazono who has an eccentric playing style. Can the heartfelt sounds of the girl's violin lead the boy to play the piano again?",/IGbeFv5Ji4W0x530JcSHiQpamY.jpg
73055,Attack on Titan: No Regrets,"Many years before becoming the famed captain of the Survey Corps, a young Levi struggles to survive in the capital's garbage dump, the Underground. As the boss of his own criminal operation, Levi attempts to get by with meager earnings while aided by fellow criminals, Isabel Magnolia and Farlan Church. With little hope for the future, Levi accepts a deal from the anti-expedition faction leader Nicholas Lobov, who promises the trio citizenship aboveground if they are able to successfully assassinate Erwin Smith, a squad leader of the Survey Corps.",/xGdz67d5WHIU7kIqVHO2TxIpmhZ.jpg
117376,Vincenzo,"Vincenzo Cassano is an Italian lawyer and Mafia consigliere who moves back to Korea due to a conflict within his organization. He ends up crossing paths with a sharp-tongued lawyer named Cha-young, and the two join forces in using villainous methods to take down villains who cannot be punished by the law.",/dvXJgEDQXhL9Ouot2WkBHpQiHGd.jpg
84669,The Quintessential Quintuplets,"Fuutarou Uesugi is a poor, antisocial ace student who one day meets the rich transfer student Itsuki Nakano. They argue but when Uesugi realizes he is to be her tutor, he tries to get on better terms. While trying to do so he meets four other girls.",/mrahUSmFjae8UHtlOcZ58ytmAGu.jpg
32118,Generator Rex,"Generator Rex, an average teenager with the ability to turn his body into amazing machines, helps the secret organization Providence save the world from the nanite threat and dangerous EVO monsters.",/fL7S22SWWOjJTgHEkk68VZ4Z8RO.jpg
68129,Yuri!!! on Ice,"Yūri Katsuki carried all of Japan's hopes on his shoulders to win at the Gran Prix Finale ice skating competition, but suffered a crushing defeat. He returns home to Kyushu and half feels like he wants to retire, and half feels like he wants to continue ice skating. Suddenly the five-time consecutive world championship ice skater Victor Nikiforov appears before him with Yuri Plisetsky, a young Russian figure skater who is already defeating his seniors. Victor and both Yuris take up the challenge on an unprecedented Gran Prix series.",/oKVFf2uNCLMsovWBxAW14MmhHUm.jpg
79141,Scissor Seven,"Seeking to recover his memory, a scissor-wielding, hairdressing, bungling quasi-assassin stumbles into a struggle for power among feuding factions.",/A39DWUIrf9WDRHCg7QTR8seWUvi.jpg
65930,My Hero Academia,"In a world where eighty percent of the population has some kind of super-powered Quirk, Izuku was unlucky enough to be born completely normal. But that won't stop him from enrolling in a prestigious hero academy. Now, he'll get his first taste of brutal rivalry from other schools as he braves the cutthroat, no-holds-barred provisional license exam.",/phuYuzqWW9ru8EA3HVjE9W2Rr3M.jpg
98214,Villainous,"Follow the misadventures of the Black Hat Org. with evil handyman Black Hat and his less evil aides Dr. Flugslys, Demencia, 5.0.5, Cam Bot, and Penumbra.",/uKtxJqOeB74Lm6ZNCyEqMaFlXbp.jpg
94796,Crash Landing on You,"A paragliding mishap drops a South Korean heiress in North Korea -- and into the life of an army officer, who decides he will help her hide.",/bXo9sDqMmo4dEOPSPLR7sdYPTvz.jpg
60863,Haikyu!!,"Based off of the original Weekly Shonen Jump manga series from Haruichi Furudate, Haikyu!! is a slice-of-life sports anime revolving around Shouyou Hinata's love of volleyball. Inspired by a small-statured pro volleyball player, Hinata creates a volleyball team in his last year of middle school. Unfortunately the team is matched up against the ""King of the Court"" Tobio Kageyama's team in their first tournament and inevitably lose. After the crushing defeat, Hinata vows to surpass Kageyama. After entering high school, Hinata joins the volleyball team only to find that Tobio has also joined.",/pLpQZHVduTzJTOVNmWfppY9tk3W.jpg
83121,Kaguya-sama: Love is War,"Considered a genius due to having the highest grades in the country, Miyuki Shirogane leads the prestigious Shuchiin Academy's student council as its president, working alongside the beautiful and wealthy vice president Kaguya Shinomiya. The two are often regarded as the perfect couple by students despite them not being in any sort of romantic relationship.",/5khbC6AuNgnvnoDbjIMKCOhEtIc.jpg
62741,Kamisama Kiss,"Nanami was just a normal high school girl down on her luck until a stranger’s lips marked her as the new Land God and turned her world upside down. Now, she’s figuring out the duties of a deity with the help of Tomoe, a reformed fox demon who reluctantly becomes her familiar in a contract sealed with a kiss. The new responsibilities—and boys—are a lot to handle, like the crow demon masquerading as a gorgeous pop idol and the adorable snake spirit who’s chosen the newly minted god to be his bride. As the headstrong Tomoe tries to whip her into shape, Nanami finds that love just might have cute, pointed fox ears. With romance in the air, will the human deity be able to prove herself worthy of her new title?",/5E7GL8KxpFemEFl3Lv8Fu4RuSwa.jpg
67389,Golden Time,"Banri Tada is a freshman at a Tokyo law school. After an accident, he suffers severe memory loss. Despite the incident, he befriends fellow freshman, Mitsuo Yanagisawa, which leads him to the beautiful, yet obsessive, Kouko Kaga.",/qp4eHCZMR14dtubvzr67PZqH5fa.jpg
85937,Demon Slayer: Kimetsu no Yaiba,"It is the Taisho Period in Japan. Tanjiro, a kindhearted boy who sells charcoal for a living, finds his family slaughtered by a demon. To make matters worse, his younger sister Nezuko, the sole survivor, has been transformed into a demon herself. Though devastated by this grim reality, Tanjiro resolves to become a “demon slayer” so that he can turn his sister back into a human, and kill the demon that massacred his family.",/wrCVHdkBlBWdJUZPvnJWcBRuhSY.jpg
68349,Weightlifting Fairy Kim Bok-Joo,"A spunky female weightlifter and free-spirited male swimmer meet on campus, only to find out their pasts may be intertwined.",/4CrTjZ5MYdF5dtSockIStCkiX5C.jpg
96316,Rent-a-Girlfriend,"In today’s Japan, ""rental"" services can deliver an afternoon with a ""friend,"" a ""parent,"" even a fake girlfriend! Kinoshita Kazuya is a 20-year-old failure of a college student. He managed to kiss his girlfriend once, but was dumped after a month.  Completely spiteful, Kazuya gets just desperate enough to give it a try. But he quickly discovers how complicated it can be to ""rent"" an emotional connection… and his new ""girlfriend,"" Mizuhara Chizuru, who’s trying to keep her side hustle secret, will panic when she finds out her real life and Kazuya’s are intertwined in surprising ways! A reckless rom-com filled with love and excitement is about to begin!",/4rqyyM0R3a0EeSlEvdpxDKbjiKB.jpg
95666,Helluva Boss,"Follow Blitzo, a classic demon Imp who sets out to run his own small assassin business with his weapons specialist Moxxie, his bruiser Millie, and his receptionist hellhound Loona. Together they attempt to survive each other while running a startup in Hell.",/mEHUgujxM62HtOyqNgZFENMIqgb.jpg
95557,Invincible,"Mark Grayson is a normal teenager except for the fact that his father is the most powerful superhero on the planet. Shortly after his seventeenth birthday, Mark begins to develop powers of his own and enters into his father’s tutelage.",/yDWJYRAwMNKbIYT8ZB33qy84uzO.jpg
92685,The Owl House,"An animated fantasy-comedy series that follows Luz, a self-assured teenage girl who accidentally stumbles upon a portal to a magical world where she befriends a rebellious witch, Eda, and an adorably tiny warrior, King. Despite not having magical abilities, Luz pursues her dream of becoming a witch by serving as Eda's apprentice at the Owl House and ultimately finds a new family in an unlikely setting.",/f3Dd784YEpaWaJUyRCkhiaKxgB0.jpg
87432,We Never Learn: BOKUBEN,"Nariyuki Yuiga is in his last and most painful year of high school. In order to gain the “special VIP recommendation” which would grant him a full scholarship to college, he must now tutor his classmates as they struggle to prepare for entrance exams.

Among his pupils are “the sleeping beauty of the literary forest,” Fumino Furuhashi, and “the Thumbelina supercomputer,” Rizu Ogata–two of the most beautiful super-geniuses at the school! While these two were thought to be academically flawless, it turns out that they’re completely clueless outside of their pet subjects…!?

As Nariyuki’s life is turned upside down by these quirky girls who just never learn, he must do everything he can to get them accepted into college! The stage is set for this romantic comedy featuring prodigies who never learn when it comes to studying and love!",/fG3VClLXTvE6MpR0x8fv2q4cpGD.jpg
45790,JoJo's Bizarre Adventure,"Follow the intergenerational feud between the Joestar Family and various forces of evil, the most prominent of which is Dio Brando and his followers.",/ogAWwbh3frWtiTyyXrZaVFtqCgp.jpg
85990,Hitori Bocchi no Marumaru Seikatsu,"Hitori Bocchi suffers from extreme social anxiety, she's not good at talking to people, takes pretty extreme actions, is surprisingly adept at avoiding people, her legs cramp when she overexerts herself, gets full of herself when alone, will vomit when exposed to extreme tension and often comes up with plans. Now she is entering middle school and her only friend, Yawara Kai, is attending a different school. This leaves Bocchi alone, surrounded by new classmates with whom she must make friends before Kai will talk to her again.",/btoTzCw3zmjRtB99g2M5Mw2GUQG.jpg
31356,Big Time Rush,"Four teenage friends move from Minneapolis to Los Angeles to form a potential chart-topping boy band after Kendall is inadvertently discovered by an eccentric record executive, Gustavo Rocque. As they seize this opportunity of a lifetime, these friends embark on an exciting comedy and music-filled journey to prove to themselves and their record label that they are serious about their new career choice.",/fERf3WFpKEHRil2CCX87ubsQRZ9.jpg
62914,Merlí,"TV series about a high school philosophy teacher, Merlí, who teaches in an original way, and about the students of his class, including his own son, and the relationship, friendship, love, and problems between the students of the class.

",/eBzpj7PxyeRFCIYHQjB5kDnhX4a.jpg
82739,Rascal Does Not Dream of Bunny Girl Senpai,"Puberty Syndrome—a rumored, mysterious syndrome that only affects those in their puberty. For example, a bunny girl suddenly appeared in front of Sakuta Azusagawa. The bunny girl's real identity is Mai Sakurajima, a teenage celebrity who is currently an inactive high school senior. For some reason, her charming figure does not reflect in the eyes of others. In the course of revealing the mystery behind this phenomenon, Sakuta begins to explore his feelings towards Mai. Set in a city where the skies and seas shine, Sakuta unfolds the meaning behind his bizarre encounters on women with the said syndrome.",/cU4jHfo1Q9AEPnFqFqtuSA74gdi.jpg
60625,Rick and Morty,"Rick is a mentally-unbalanced but scientifically gifted old man who has recently reconnected with his family. He spends most of his time involving his young grandson Morty in dangerous, outlandish adventures throughout space and alternate universes. Compounded with Morty's already unstable family life, these events cause Morty much distress at home and school.",/8kOWDBK6XlPUzckuHDo3wwVRFwt.jpg
45950,High School DxD,"The story follows Issei Hyōdō, a dim-witted, lecherous second-year high school student who is killed by a girl on his first date ever. Issei is reincarnated as a devil, and from that day forward, he serves as an underling of Riasu, a high-level devil who is also the prettiest girl on Issei's campus.",/5a9vaaLDAZTYjgfWIw7ZYhL1m1A.jpg
95269,Toilet-Bound Hanako-kun,"The famous ""Seven Wonders"" that every school seems to have are a staple of Japanese urban legends. One of the most well-known of these tales is that of Hanako-san: the ghost of a young girl who haunts the school's bathrooms.

Kamome Academy has its own version of Hanako-san's legend. Rumors claim that if one successfully manages to summon Hanako-san, she will grant her summoner any wish. Lured by the gossip, many people have tried to call upon her, yet every attempt has failed. However, when Nene Yashiro, a girl hoping for romantic fortune, dares to summon Hanako-san, she discovers that the rumored ""girl"" is actually a boy!

After a series of unfortunate events involving Nene's romantic desires, she is unwillingly entangled in the world of the supernatural, becoming Hanako-kun's assistant. Soon, she finds out about Hanako-kun's lesser-known duty: maintaining the fragile balance between mortals and apparitions.",/qp2XSpNzopObSPkSAi7sujAsdh3.jpg
70785,Anne with an E,"A coming-of-age story about an outsider who, against all odds and numerous challenges, fights for love and acceptance and for her place in the world. The series centers on a young orphaned girl in the late 1890’s, who, after an abusive childhood spent in orphanages and the homes of strangers, is mistakenly sent to live with an elderly woman and her aging brother. Over time, 13-year-old Anne will transform their lives and eventually the small town in which they live with her unique spirit, fierce intellect and brilliant imagination.",/6P6tXhjT5tK3qOXzxF9OMLlG7iz.jpg
82684,That Time I Got Reincarnated as a Slime,"37-year-old corporate worker Mikami Satoru is stabbed by a random killer, and is reborn to an alternate world. But he turns out to be reborn a slime! Thrown into this new world with the name Rimuru Tempest, he begins his quest to create a world that’s welcoming to all races. Broken free from ordinary, stale past life, his fresh adventure in a fantasy world as a slime monster with unique abilities begins.",/jQb1ztdko9qc4aCdnMXShcIHXRG.jpg
83880,Our Planet,Experience our planet's natural beauty and examine how climate change impacts all living creatures in this ambitious documentary of spectacular scope.,/wRSnArnQBmeUYb5GWDU595bGsBr.jpg
77721,Real Girl,"Tsutsui Hikari (a.k.a ""Tsuttsun"") is a high school student who is content with his virtual life of anime and video games. One day, he gets stuck cleaning the pool with Iroha, a real live girl who is stylish, sassy and known to be easy with boys ... and she aggressively approaches him! Tsuttsun, who has few friends and lives in his own world, finds himself smitten by the confident and wild Iroha ... and his whole world is turned upside down!! It's the awkward and pure love story of a boy who experiences relationship for the first time.",/3UmNynM1YXkYylyontGXPHncjOC.jpg
46298,Hunter x Hunter,"Twelve-year-old Gon Freecss one day discovers that the father he had always been told was dead was alive. His Father, Ging, is a Hunter — a member of society's elite with a license to go anywhere or do almost anything. Gon, determined to follow in his father's footsteps, decides to take the Hunter Examination and eventually find his father to prove himself as a Hunter in his own right. But on the way, he learns that there is more to becoming a Hunter than previously thought, and the challenges that he must face are considered the toughest in the world.",/tolQj5yffSxkEGXusPwNcvYrbph.jpg
79732,She-Ra and the Princesses of Power,"In this reboot of the '80s series, a magic sword transforms an orphan girl into warrior She-Ra, who unites a rebellion to fight against evil.",/y6YLtlnV5FGh3Mhs5SUc80IQSV5.jpg
89456,Primal,A caveman forms a bond with a dinosaur as they struggle to survive in a hostile world.,/9jIatSC61s5Y3d5Q63yIeZFvP7u.jpg
75214,Violet Evergarden,"The Great War finally came to an end after four long years of conflict; fractured in two, the continent of Telesis slowly began to flourish once again. Caught up in the bloodshed was Violet Evergarden, a young girl raised for the sole purpose of decimating enemy lines. Hospitalized and maimed in a bloody skirmish during the War's final leg, she was left with only words from the person she held dearest, but with no understanding of their meaning.

Recovering from her wounds, Violet starts a new life working at CH Postal Services after a falling out with her new intended guardian family. There, she witnesses by pure chance the work of an ""Auto Memory Doll,"" amanuenses that transcribe people's thoughts and feelings into words on paper. Moved by the notion, Violet begins work as an Auto Memory Doll, a trade that will take her on an adventure, one that will reshape the lives of her clients and hopefully lead to self-discovery.",/ImvHbM4GsJJykarnOzhtpG6ax6.jpg
37854,One Piece,"Years ago, the fearsome pirate king Gol D. Roger was executed, leaving a huge pile of treasure and the famous ""One Piece"" behind. Whoever claims the ""One Piece"" will be named the new pirate king. Monkey D. Luffy, a boy who consumed a ""Devil's Fruit,"" decides to follow in the footsteps of his idol, the pirate Shanks, and find the One Piece. It helps, of course, that his body has the properties of rubber and that he's surrounded by a bevy of skilled fighters and thieves to help him along the way. Luffy will do anything to get the One Piece and become King of the Pirates!",/dum1wnm6kJOUos0XJqjB8s2UWi9.jpg
93256,Cautious Hero: The Hero Is Overpowered but Overly Cautious,"There is a popular saying: ""you can never be too careful."" It is very important to prepare for every situation you may face, even if it seems like an unnecessary waste of time. Also, in games like RPGs, it is good to exceed the level of your enemies to achieve total victory.

These words describe Seiya Ryuuguuin a little too perfectly. After being summoned by the goddess Ristarte to save the world of Gaeabrande from destruction, the hero prepares himself for his noble journey. While this might be normal, he spends a very long time training himself, despite having overpowered stats. He fights weak enemies using his strongest skills and buys excessive amounts of supplies and potions—all to stay safe.

While his attitude may be a bit annoying, it might just be the saving grace of Gaeabrande, especially considering that it is a world where the forces of evil dominate each and every expectation.",/bbg1FMU7c3W06KUKrgIhIECFliZ.jpg
67915,Goblin,"In his quest for a bride to break his immortal curse, a 939-year-old guardian of souls meets a grim reaper and a sprightly student with a tragic past.",/c2gon6zbqzL73DOl8mPQMMUJXvE.jpg
1396,Breaking Bad,"When Walter White, a New Mexico chemistry teacher, is diagnosed with Stage III cancer and given a prognosis of only two years left to live. He becomes filled with a sense of fearlessness and an unrelenting desire to secure his family's financial future at any cost as he enters the dangerous world of drugs and crime.",/ggFHVNu6YYI5L9pCfOacjizRGt.jpg
73833,The Ancient Magus' Bride,"Fifteen-year-old Chise has nothing and no one to live for. But that changes when she becomes the apprentice and future wife of inhuman mage, Elias.",/vUm0WIGGgAnXYOSBeB36FKDpBjI.jpg
