id,title,overview,poster_path
62560,Mr. Robot,"A contemporary and culturally resonant drama about a young programmer, Elliot, who suffers from a debilitating anti-social disorder and decides that he can only connect to people by hacking them. He wields his skills as a weapon to protect the people that he cares about. Elliot will find himself in the intersection between a cybersecurity firm he works for and the underworld organizations that are recruiting him to bring down corporate America.",/oKIBhzZzDX07SoE2bOLhq2EE8rf.jpg
94795,Cagaster of an Insect Cage,"Thirty years after a disease that turns the infected into carnivorous insects emerged, a young exterminator and a teenage girl search for her mother.",/yOIixxFPbfcGytrcYdRrC9Y1bT5.jpg
96203,Gleipnir,"Shuichi Kagaya is an ordinary high school kid in a boring little town. But when a beautiful classmate is caught in a warehouse fire, he discovers a mysterious power: he can transform into a furry dog with an oversized revolver and a zipper down his back. He saves the girl’s life, sharing his secret with her. But she’s searching for the sister who killed her family, and she doesn’t care how degrading it gets: she will use Shuichi to accomplish her mission…",/eF1kUIoyL2dxPGGsxNXYrkrAPs2.jpg
104877,Love Is In The Air,"Eda, who ties all her hopes to her education, confronts Serkan Bolat, who cuts off her international education scholarship and leaves her with high school diploma. Serkan Bolat offers Eda to give her scholarship back if she pretends to be his fiance for two months. Although Eda rejects the offer of this man as she hates him, she has to accept it when the conditions change. While pretending to be engaged, Serkan and Eda begin to experience a passionate, challenging relationship that will make them forget all they know right. Because love is difficult. And that's why it's amazing.",/nzBenFJ2D2MCWTwTt2uc4BGWLtA.jpg
72002,Dynasty,"The reboot follows two of America’s wealthiest families, the Carringtons and the Colbys, as they feud for control over their fortune and their children focusing on Fallon Carrington, the daughter of billionaire Blake Carrington, and her soon-to-be stepmother, Cristal, a Hispanic woman marrying into this WASP family and America’s most powerful class.",/rVQ35erLIoV8hyh7lIKAMiChmOO.jpg
100883,Never Have I Ever,"After a traumatic year, all an Indian-American teen wants is to go from pariah to popular -- but friends, family and feeling won't make it easy on her.",/mVHy2CbUqtnNYi7v6oOl6fV1Bm6.jpg
6782,Pucca,"""Pucca"" is a TV series based on a Flash animation series published by Vooz Character Systems. It follows the trails and exploits of a South Korean girl named Pucca who is insanely in love with a prideful ninja named Garu. Meanwhile, Garu and Pucca help their town of Sooga Village out when evil ninjas attack, as well as diffuse a lot of the absurd situations that frequently plague the town. This show could best be described as a cleaned-up version of South Park meets Looney Tunes meets Naruto. There is some very subtly hidden adult humor; but most of the adult jokes would not go noticed by small children, who are the primary audience.",/6OzIemktrnfbcPSjCM94TUlACWx.jpg
38974,Jessie,"An idealistic teen from rural Texas embarks on the adventure of a lifetime when she decides to leave behind starry nights for big city lights. Thrilled to be on her own and determined not to be intimidated by New York City, she accepts a job as nanny for a high-profile couple with four kids. Helping to keep her moral compass in check are Bertram, the family's butler, and Tony, the building's 20-year-old doorman.",/tspQe0FuiaUj0U1R1norNbiYTe4.jpg
35279,Austin & Ally,"A comedy about the unique relationship between a young songwriter, Ally Dawson, and Austin Moon, the overnight internet sensation who gains sudden notoriety after performing one of Ally's songs. Austin and Ally struggle with how to maintain and capitalize on Austin's newfound fame. Austin is more of a rebel type who doesn't follow the rules and is somewhat immature for his age, while Ally is conservative yet self-conscious.",/g4oZ5AU1ZXVnVf4hXqbRARwRJwq.jpg
12406,Powerpuff Girls Z,"Professor Utonium and his son Ken are studying the strange Chemical X. When a mochi cake falls into the formula, it changes into Chemical Z. Ken fires a ray of Chemical Z at a glacier in Tokyo Bay, however that causes strange lights to scatter, some of them aim at three normal girls, Momoko, Miyako, and Kaoru. This gives them the power to transform into superheroes, the Powerpuff Girls Z!",/eyma9skDvtn6drk7sFtfmbTV3Vb.jpg
1920,Twin Peaks,The body of Laura Palmer is washed up on a beach near the small Washington state town of Twin Peaks. FBI Special Agent Dale Cooper is called in to investigate her strange demise only to uncover a web of mystery that ultimately leads him deep into the heart of the surrounding woodland and his very own soul.,/lA9CNSdo50iQPZ8A2fyVpMvJZAf.jpg
73946,Inuyashiki: Last Hero,"Inuyashiki Ichirou is down on his luck. While only 58 years old, his geriatric looks often have him written off as a pathetic old man by the world around him and he’s constantly ignored and disrespected by his family despite all that he’s done to support them. On top of everything else, his doctor has revealed that he has cancer and it appears that he has little time left in this world. But just when it seems things couldn’t get any worse, a blinding light in the night sky strikes the earth where Ichirou stands. He later wakes up to find himself unscathed, but he soon starts to notice that there’s something… different about himself. However, it turns out that these strange, new changes are just what Ichirou needs to take a new lease on life and now it seems like there’s nothing to stop him from being a hero worthy of the respect that he never had before… unless, that is, there was someone else out there with these same changes…",/VKhdHvqY3vMeBcZ6UOJanUmeYs.jpg
86430,Your Honor,New Orleans judge Michael Desiato is forced to confront his own deepest convictions when his son is involved in a hit and run that embroils an organized crime family.,/xWJZjIKPeEZhK3JRYKOe06yW6IU.jpg
35016,House of Anubis,"Strange things are happening at an English boarding school called House of Anubis. Popular student Joy goes missing, the school's cranky caretaker has a creepy stuffed crow and the school's attic may be haunted. When recent American transplant Nina gets thrust into the school during this time, she decides to investigate along with her new friend, Fabian, and housemates.",/llPkPieIBfVXKIklkeP5VddpK8b.jpg
74577,The End of the F***ing World,"James is 17 and is pretty sure he is a psychopath. Alyssa, also 17, is the cool and moody new girl at school. The pair make a connection and she persuades him to embark on a darkly comedic road trip in search of her real father.",/f1OV9xEJCZVYcYSDRr5xOD8NJw3.jpg
126531,Elite Short Stories: Guzmán Caye Rebe,"Rebe hosts an intimate house warming party for her friends, but the situation takes a dramatic turn with the help of drugs and unexpected visitors.",/4Y3jaO9schbo32WB2fGQv1en8ZB.jpg
69740,Ozark,"A financial adviser drags his family from Chicago to the Missouri Ozarks, where he must launder $500 million in five years to appease a drug boss.",/m73bD8VjibSKuTWg597GQVyVhSb.jpg
95314,Juliantina,"A spin-off for Juliana and Valentina from the Spanish soap opera, Amar a Muerte. Story of two girls with many differences such as social status and education, but that didn't stop them from being very good friends who ended up falling in love. With a surprising and nothing morbid interpretation the actresses gave voice and courage to many to express their feelings without fear. A love story that shows us that Love is Love.",/loqrU2DvWUhghU2hPkWPaen4lSJ.jpg
67136,This Is Us,"Follows the lives and families of three adults living and growing up in the United States of America in present and past times. As their paths cross and their life stories intertwine in curious ways, we find that several of them share the same birthday - and so much more than anyone would expect.",/wyjDXLfVaoxjQ0Cjv7sZy51M5ys.jpg
42912,Inazuma Eleven,"Endou Mamoru is a cheerful goalkeeper in Raimon Jr High, with six other players in the team. But there was a day when the team was almost lead to disbandment by Natsumi unless they are to win the match against the Teikoku Gakuen, currently the best team of Japan. He tried to save the club by gathering four more players to the team.",/9kQWvBMPWz1gykKLXuX6JBjC9uQ.jpg
90,Mayday,"Revealing the dark truth that aviation safety improves one crash at a time, Mayday  investigates legendary aviation disasters to find out what went wrong and why.

Based on cockpit voice recorders, accident reports and eyewitness accounts, every episode also features interviews, state-of-the-art CGI and gripping reenactments.",/dTTl7DR23zr8IlPSMh2Vcfumyo3.jpg
79649,Project Blue Book,"A chronicle of the true top secret U.S. Air Force-sponsored investigations into UFO-related phenomena in the 1950s and ’60s, known as “Project Blue Book.”",/rqrzjT5nc7mTD5IKVMLRhLeyzgD.jpg
1405,Dexter,"Dexter Morgan, a blood spatter pattern analyst for the Miami Metro Police also leads a secret life as a serial killer, hunting down criminals who have slipped through the cracks of justice.",/58H6Ctze1nnpS0s9vPmAAzPcipR.jpg
3498,Wizards of Waverly Place,"Alex, Justin and Max Russo are not your ordinary kids - they're wizards in training! While their parents run the Waverly Sub Station, the siblings struggle to balance their ordinary lives while learning to master their extraordinary powers.",/pDwdSdcmL4GZNzXNnjxljodDmQB.jpg
122194,CSI: Vegas,"Facing an existential threat that could bring down the Crime Lab, a brilliant team of forensic investigators must welcome back old friends and deploy new techniques to preserve and serve justice in Sin City.",/rUrZj1su654gz9neAiJs9z1y56Z.jpg
62227,Triage X,"Mochizuki General Hospital boasts some of the most well-trained nurses in town. But though these ladies spend much of their day battling sickness, their after-hours are spent fighting a very different sort of disease... Under the leadership of the hospital chairman, a handful of staff members and local teenagers form a group of mercenary assassins, targeting the ""cancers"" of society and excising those individuals before their wickedness spreads.",/eQuP3VBa7asCrQdaPG2SeZp4KlA.jpg
51817,Teenage Mutant Ninja Turtles,"The Teenage Mutant Ninja Turtles are back in an all-new animated series on Nickelodeon! Surfacing topside for the first time on their fifteenth birthday, the titular turtles, Leonardo, Michelangelo, Raphael and Donatello, find that life out of the sewers isn't exactly what they thought it would be. Now the turtles must work together as a team to take on new enemies that arise to take over New York City.",/ncSzMsFCy5HXQzo3JBgxkX10FER.jpg
86831,"Love, Death & Robots","Terrifying creatures, wicked surprises and dark comedy converge in this NSFW anthology of animated stories presented by Tim Miller and David Fincher.",/asDqvkE66EegtKJJXIRhBJPxscr.jpg
82817,Go Go Squid!,"Tong Nian is a genius 19-year-old student with high IQ and low EQ, who is also a famous anime cosplay person and sings well. She’s falls in love at first sight with Han Shang Yan, who is a game genius in the e-sports world and never pays attention to the girls.",/xWnuIoWFejrYJXeEyJYUH4ILlVo.jpg
21729,Gurren Lagann,"In the distant future, mankind has lived quietly and restlessly underground for hundreds of years, subject to earthquakes and cave-ins. Living in one such village are 2 young men: one named Simon who is shy and naïve, and the other named Kamina who believes in the existence of a “surface” world above their heads.",/xL6HsYsk5N9PKwk6jFwMNQq3K3M.jpg
34105,Golden Boy,"Kintaro Oe is a 25-year-old boy who left Tokyo University and now lives a simple life, traveling by bicycle to learn everything he can about the world.",/fx2DqPaW5OwFTBgS4nbTuCxdYFj.jpg
5768,Paradise City,A controversial rock band with ties to the occult and the maestros who work with them try to keep their west coast family dynamic together amidst the chaos of the industry as a haunting secret of the singer and a young groupie arrives on his doorstep. Their path intertwines with an east coast rookie kid who idolizes them and tries to make his way in the music business as the ultimate underdog.,/fSWXCeTS80yR1vHTLVRRagyQmjQ.jpg
101591,BMF,"The drug trafficking drama is inspired by the true story of two brothers who rose from the decaying streets of southwest Detroit in the late 1980s and gave birth to one of the most influential crime families in the country. It revolves around brothers Demetrius ""Big Meech"" Flenory and Terry ""Southwest T"" Flenory, who together took their vision beyond the drug trade and into the world of hip-hop. The drama, per Starz, will tell a story about love, family and capitalism in the pursuit of the American dream.",/hcbRz5D3yRnYjvXXfO1B61TYUqr.jpg
21409,Dinosaur King,"Dinosaur King is a card-based arcade game from Sega that uses the same gameplay mechanics from Mushiking but uses super-powered dinosaurs instead of beetles. The game was revealed in JAMMA 2005 and is available in Japanese and English versions. A Nintendo DS version has also been released in North America.

In the fall of 2008, Upper Deck Company released a Dinosaur King Trading Card Game. This card game is not to be confused with the cards used for the arcade machines.

The series has been adapted into an anime TV series, Ancient Ruler Dinosaur King DKidz Adventure, which is made by Sunrise and premiered on TV Asahi on February 4, 2007. As of 2008, an English adaptation aired on the 4Kids TV block on the Fox Network, but moved to The CW's The CW4Kids block on September 6, 2008.

A sequel was announced called ""Ancient Ruler Dinosaur King DKidz Adventure: Pterosaur Legend,"" which debuted February 3, 2008 in Japan.

The show ended its run in Japan in late 2008.",/y6KWd6u4sU6vXMA9b9Gj9M5NvtJ.jpg
65292,Ajin,"17 years ago, immortals first appeared on the battlefields of Africa. Later, rare, unknown new immortal lifeforms began appearing among humans, and they became known as ""Ajin"" (demi-humans). Just before summer vacation, a Japanese high school student is instantly killed in a traffic accident on his way home from school. However, he is revived, and a price is placed on his head. Thus begins a boy's life on the run from all of humankind.",/fnHBwIKxwrFleSzvHzTqcAzDRM.jpg
12609,Dragon Ball,"Long ago in the mountains, a fighting master known as Gohan discovered a strange boy whom he named Goku. Gohan raised him and trained Goku in martial arts until he died. The young and very strong boy was on his own, but easily managed. Then one day, Goku met a teenage girl named Bulma, whose search for the mystical Dragon Balls brought her to Goku's home. Together, they set off to find all seven and to grant her wish.",/tZ0jXOeYBWPZ0OWzUhTlYvMF7YR.jpg
3137,Babylon 5,"Babylon 5 is a five-mile long space station located in neutral space. Built by the Earth Alliance in the 2250s, it's goal is to maintain peace among the various alien races by providing a sanctuary where grievances and negotiations can be worked out among duly appointed ambassadors. A council made up of representatives from the five major space-faring civilizations - the Earth Alliance, Minbari Federation, Centauri Republic, Narn Regime, and Vorlon Empire - work with the League of Non-Aligned Worlds to keep interstellar relations under control. Aside from its diplomatic function, Babylon 5 also serves as a military post for Earth and a port of call for travelers, traders, businessmen, criminals, and Rangers.",/rj87TqwabgJzslrH4G6BCDseBKV.jpg
84958,Loki,"After stealing the Tesseract during the events of “Avengers: Endgame,” an alternate version of Loki is brought to the mysterious Time Variance Authority, a bureaucratic organization that exists outside of time and space and monitors the timeline. They give Loki a choice: face being erased from existence due to being a “time variant” or help fix the timeline and stop a greater threat.",/kEl2t3OhXc3Zb9FBh1AuYzRTgZp.jpg
80477,Angels of Death,"Most girls waking up without any memory and meeting a serial killer would panic, but not Rachel. In fact, far from being her biggest problem, killer Zack might just prove a convenient resource when it comes to finding a way out of the building in which they're both trapped!",/74OJEbRx1swuh5EuT7VNWxyWTZd.jpg
61593,Mr. Pickles,"The Goodman family lives with their lovable pet dog, Mr. Pickles, a deviant border collie with a secret satanic streak.",/T8UgM63U5IMeVjNBq0Dvg8ga2S.jpg
61339,Sailor Moon Crystal,Usagi Tsukino is chosen to be a guardian of justice and is sent on a quest to locate a Silver Crystal before the Dark Kingdom invades the Earth.,/1JFldXBiL9XDF7Cb7EotN40oMYA.jpg
77607,Laws of love,"The story of two lawyers specializing in family law, Ricardo and Alejandra, that despite coming from two disappointments and being in a world where it seems that love loses strength, before so much divorce, they still have faith in finding true love.",/npiUbnBvgzAKvFe0eqT8VqhQ0yn.jpg
42445,Borgen,"40-year old political leader Birgitte Nyborg secures her party a landslide victory through her idealism and huge effort, then faces the biggest challenge of her life: how most effectively to use the newly won seats, and how far she is willing to go in order to gain as much influence as possible.",/fiRa22dXJYkYKxz5PXEC2do6g6u.jpg
78173,Dragons: Race to the Edge,"Unlock the secrets of the Dragon Eye and come face to face with more dragons than anyone has ever imagined as Hiccup, Toothless and the Dragon Riders soar to the edge of adventure.",/8p0raLxaxLeK4g19eXk39RfUrb7.jpg
2085,Courage the Cowardly Dog,"The bizarre misadventures of a cowardly dog named Courage and his elderly owners in a farmhouse in Nowhere, Kansas.",/3upyO2ISjkBHuvPyYV3e8X96Fj8.jpg
99494,Flower of Evil,"Hiding a twisted past, a man maintains his facade as the perfect husband to his detective wife — until she begins investigating a series of murders.",/xHlCeCLxZz94a7oTOKHB46eTXiV.jpg
1988,ThunderCats,"The inhabitants of the planet Thundera evacuate just before it is destroyed. They were pursued by a band of mutants. All but one of their escape ships was destroyed. Only a small group of Thunderans (Thundercats) remained. With only half engine power, the group, which was led by Jaga, had to set a course for the nearest planet. Jaga commanded their ship while the other seven were in their stasis tubes. Jaga died on their journey to Third Earth and their ship crashed there. Soon they made friends with various groups in the area and they designed a fortress. Mumm-Ra the centuries-old embodiment of evil, along with the mutants that destroyed the rest of the Thunderans are a constant threat. But Lion-O, the new leader of the Thundercats, with his weapon the ""Sword of Omens"" will help the Thundercats to have a standing chance.",/ftcrZw3Xj89o1NLH4YHgAWfXbdi.jpg
114547,Secrets of Sulphur Springs,"12-year-old Griffin Campbell and his family move to the small town of Sulphur Springs and take ownership of an abandoned hotel rumored to be haunted by the ghost of a girl who disappeared decades ago. Griffin befriends Harper, a bright-eyed, mystery-obsessed classmate and together, they uncover a secret portal that allows them to travel back in time. In the past, they’ll attempt to uncover the key to solving this unsolved mystery, a mystery that affects everyone close to them.",/2huc4Ef44MBNlbYMa2qjqFvyW2q.jpg
62715,Dragon Ball Super,"With Majin Boo defeated half-a-year prior, peace returns to Earth, where Son Goku (now a radish farmer) and his friends now live peaceful lives. However, a new threat appears in the form of Beerus, the God of Destruction. Considered the most terrifying being in the entire universe, Beerus is eager to fight the legendary warrior seen in a prophecy foretold decades ago known as the Super Saiyan God. The series retells the events from the two Dragon Ball Z films, Battle of Gods and Resurrection 'F' before proceeding to an original story about the exploration of alternate universes.",/qEUrbXJ2qt4Rg84Btlx4STOhgte.jpg
67070,Fleabag,A comedy series adapted from the award-winning play about a young woman trying to cope with life in London whilst coming to terms with a recent tragedy.,/27vEYsRKa3eAniwmoccOoluEXQ1.jpg
95057,Superman & Lois,"After years of facing megalomaniacal supervillains, monsters wreaking havoc on Metropolis, and alien invaders intent on wiping out the human race, The Man of Steel aka Clark Kent and Lois Lane come face to face with one of their greatest challenges ever: dealing with all the stress, pressures and complexities that come with being working parents in today's society.",/utpXq61UIlfNUuviz2hRmCEYdYr.jpg
110316,Alice in Borderland,"With his two friends, a video-game-obsessed young man finds himself in a strange version of Tokyo where they must compete in dangerous games to win.",/20mOwAAPwZ1vLQkw0fvuQHiG7bO.jpg
85720,Shadow and Bone,"In a world cleaved in two by a massive barrier of perpetual darkness, a young soldier uncovers a power that might finally unite her country. But as she struggles to hone her power, dangerous forces plot against her. Thugs, thieves, assassins and saints are at war now, and it will take more than magic to survive.",/mrVoyDFiDSqfH4mkoRtccOv2vwh.jpg
5303,The Storyteller,"The Storyteller aided by his cynical dog, narrates classic folk tales, fables, and legends.",/4zyfBsIxQfEK0RcfJvwXgHTKqfn.jpg
59375,Liv and Maddie,"The exploits of identical twins Liv, a former television star back home in Wisconsin and in the process of adding movie star to her credits, as well as beginning to focus on her music career, and Maddie, an outstanding student and basketball phenomenon recovering from an injured knee. The series centers on the unbreakable bond the twins share though they have wildly different personalities. To complicate their teenage lives, both parents work at their high school and their younger brothers are always stirring up trouble.",/j5iGTENbOfCHjZJ6cCrhBVdxER5.jpg
103319,The Day I Became a God,"At the end of the last summer vacation of high school, Youta Narukami spends his days preparing for the university entrance exams, when a young girl named Hina suddenly appears, proclaiming herself as the ""god of omniscience."" Youta is confused and does not believe Hina when she tells him ""The world will end in 30 days."" After witnessing Hina’s God-like predictive ability, Youta begins to believe her powers are real. Hina, who is innocent and childlike despite her supernatural powers, decides for some reason to stay at Youta’s home. Thus begins the start of their lively summer before the end of the world.",/vE0GqiDa3uNZ5zXUrFtLO6BYghc.jpg
79525,The Last Dance,"A 10-part documentary chronicling the untold story of Michael Jordan and the Chicago Bulls dynasty with rare, never-before-seen footage and sound from the 1997-98 championship season – plus over 100 interviews with famous figures and basketball’s biggest names.",/oVf4xGGbDtwVHiKn8uTuSriY7PH.jpg
56570,Outlander,"The story of Claire Randall, a married combat nurse from 1945 who is mysteriously swept back in time to 1743, where she is immediately thrown into an unknown world where her life is threatened. When she is forced to marry Jamie, a chivalrous and romantic young Scottish warrior, a passionate affair is ignited that tears Claire's heart between two vastly different men in two irreconcilable lives.",/oR0PM7hFDqY3kO12cLLQMKiJt8I.jpg
128883,Hometown Cha-Cha-Cha,"A big-city dentist opens up a practice in a close-knit seaside village, home to a charming jack-of-all-trades who is her polar opposite in every way.",/en6lrlJ1DhyvkeZEqrk3R6EJz1p.jpg
9148,Great Mazinger,"After Koji Kabuto and Sayaka Yumi leave to the USA, it's up to the rash orphan Tetsuya Tsurugi to pilot the next Mazinger robot: the Great Mazinger. Under the direction of Dr. Kenzo Kabuto and helped by his adoptive sister Jun Honou, Tetsuya battles the Miccene Empire.",/7nGqtwa4Ll4gscabYN7uGCFQdPa.jpg
4743,The Boarding School,"El Internado Laguna Negra was a Spanish television drama-thriller focusing on the students of a fictional boarding school in a forest, where teenagers are sent by their parents to study. The boarding school is situated in a forest far from the city, on the outskirts on which macabre events occur. The series debut on 24 May 2007, and is a production of Antena 3. Although the show is recorded and produced in HD, it is only broadcast in SD. However, an HD Blu-ray Disc release has been announced.",/9BVy7ZtN1WfQWJ0UbHCEE8o5e5f.jpg
86248,Upload,"In 2033, people who are near death can be “uploaded” into virtual reality hotels run by 6 tech firms. Cash-strapped Nora lives in Brooklyn and works customer service for the luxurious “Lakeview” digital afterlife. When L.A. party-boy/coder Nathan’s self-driving car crashes, his high-maintenance girlfriend uploads him permanently into Nora’s VR world.",/6SIDIB59JYsQ8EfUgM0IaFfwXtS.jpg
45016,The Bridge,"When a body is found on the bridge between Denmark and Sweden, right on the border, Danish inspector Martin Rohde and Swedish Saga Norén have to share jurisdiction and work together to find the killer.",/cS4D111Wu3EQczv0QuUPfOClupe.jpg
82428,All American,"When a rising high school football player from South Central L.A. is recruited to play for Beverly Hills High, the wins, losses and struggles of two families from vastly different worlds - Compton and Beverly Hills - begin to collide. Inspired by the life of pro football player Spencer Paysinger.",/bpmZDwQfUPVKCLfIivbWnJQT6wU.jpg
