id,title,overview,poster_path
61018,Whose Line Is It Anyway?,"The show where everything's made up and the points don't matter. Not a talk show, not a sitcom, not a game show, Whose Line Is It Anyway? is a completely unique concept to network television. Four talented actors perform completely unrehearsed skits and games in front of a studio audience. Host Drew Carey sets the scene, with contributions from the audience, but the actors rely completely on their quick wit and improvisational skills. It's genuinely improvised, so anything can happen - and often does.",/kuRhXc42nCQU4AiQ8EnZx9lpPcU.jpg
25707,Captain Tsubasa,"Tsubasa Ozora loves playing football since he was a little child. After moving to the japanese town of Nankatsu together with his mother, the 11-year-old boy quickly finds friends and joins the local football team of his elementary school. Together with his newly made friends and Brazilian mentor Roberto, Tsubasa starts his exciting journey to chase after his most desired dream - one day winning the FIFA World Cup.",/xADNeBzFTAIs4cW8kJGSNwF9qbx.jpg
3763,Dinosaurs,"Dinosaurs follows the life of a family of dinosaurs, living in a modern world. They have TV's, fridges, microwaves, and every modern convenience.",/xk1u5JGA8KU7nyg7aIaVFiCM6OT.jpg
1546,Recess,"Six brave fourth-graders at Third Street School make it their mission to protect the other kids on the playground. Despite the rule of King Bob and his minions, who enforce his unwritten laws, T.J, Ashley, Vince, Gus, Gretchen and Mikey seek a rational balance between conformity and individuality.",/oQ8wldoZJvySG9jU5Sxap39PZoY.jpg
4625,The New Batman Adventures,"The New Batman Adventures is a continuation of the acclaimed Batman: The Animated Series. Stories in this series tend to give more focus to Batman's supporting cast, which include fellow crimefighters Robin, Nightwing, and Batgirl, among others. The show also features guest stars such as Supergirl, Etrigan, and The Creeper; characters who would later appear with Batman in Justice League and Justice League Unlimited.",/s40Ji11SBKaEYDgJmDc0ifklM59.jpg
2022,The Batman,"Bruce Wayne, The Batman -- billionaire by day, crime fighter by night -- joined on occasion by Robin and Batgirl.",/t5mbrd79o89pYB8OQ4QPFNkIRPm.jpg
34793,Girls Bravo,"A high school boy, Yukinari, has been bullied and abused by girls all his life and has developed gynophobia--a fear of women. In fact, just being around them makes him break out in hives! One day, he is transferred to a world that only females inhabit.",/7oi1AruNAkgzKRn47muIP6Bq8iK.jpg
1472,Kung Fu,The adventures of a Shaolin Monk as he wanders the American West armed only with his skill in Kung Fu.,/cOCOp9NjUUO4rdgYRAboMzIFl1B.jpg
72462,Free Rein,"A 15-year-old from LA spends the summer at her mom's childhood home on an island off the coast of England, where she bonds with a mysterious horse.",/g3DccaRLKOiNPHnH88sxGIL943B.jpg
1428,MythBusters,"MythBusters is a science entertainment television program created and produced by Australia's Beyond Television Productions for the Discovery Channel. The show's hosts, special effects experts Adam Savage and Jamie Hyneman, use elements of the scientific method to test the validity of rumors, myths, movie scenes, adages, Internet videos, and news stories.",/9MxhqYvwx8FSb5cRWUWEDfpWSfo.jpg
130,All Grown Up!,"All Grown Up! is an animated television series created by Arlene Klasky and Gábor Csupó for Nickelodeon. After the success of All Growed Up, the Rugrats 10th anniversary special, Nickelodeon commissioned All Grown Up! as a spin-off series based on the episode. The series ran from April 12, 2003 to August 17, 2008, and currently airs in reruns on Nickelodeon and Nicktoons. The show aired in reruns on The N from August 18, 2003 until November 12, 2005, it was dropped from the channel on February 2006, but then returned in April 2007 until June 25, 2009, then on July 7, 2009, All Grown Up! was dropped from The N again. The show's premise is that the characters of the Rugrats are ten years older. Tommy, Dil, Chuckie, Phil, Lil, Kimi, Angelica and Susie now have to deal with teen and pre-teen issues and situations.

It was the first Nicktoon spin-off receiving positive review among critics, and developed a cult following after its run.",/nCIynTNeWPTrE75vefGuzHvfIhm.jpg
78670,Impulse,"16-year-old Henry Coles is an outsider in her new town of Reston, New York. With a major chip on her shoulder and no friends, she remains withdrawn and isolated, but everything changes when a traumatic encounter with a classmate triggers something deep within Henry— unleashing a power she cannot control.",/sMZMj1gCDZA9eZzHpEmDMpQ0Iur.jpg
33761,Triumph of Love,"Triunfo del Amor is a Mexican telenovela, starring Maite Perroni, William Levy, and Victoria Ruffo as the main protagonists. Dominika Paleta, Guillermo García Cantú and Daniela Romo star as the main antagonists. It is based on El Privilegio de Amar produced in 1998, a remake of Delia Fiallo's classic Cristal produced in 1985. Triunfo del Amor won 3 awards in Premios TVyNovelas: Best female antagonist, best first actor, and best young lead actress.",/hOZjxSRDERIk0FXOVD0yKs8C7OQ.jpg
93405,Squid Game,"Hundreds of cash-strapped players accept a strange invitation to compete in children's games—with high stakes. But, a tempting prize awaits the victor.",/dDlEmu3EZ0Pgg93K2SVNLCjCSvE.jpg
2171,Cold Case,The Philadelphia homicide squad's lone female detective finds her calling when she is assigned cases that have never been solved. Detective Lilly Rush combines her natural instincts with the updated technology available today to bring about justice for all the victims she can.,/vVYi4meH1UGGpvgxZ9M9Ez9MUt0.jpg
69541,Harlots,"Brothel owner, Margaret Wells, struggles to raise her daughters in London during the 18th century.",/w6F93B2ZUCEUhRpgCS1cU82htqz.jpg
66761,Medici: Masters of Florence,"The story of the Medici family of Florence, their ascent from simple merchants to power brokers sparking an economic and cultural revolution. Along the way, they also accrue a long list of powerful enemies.",/vFtsI6Nk3cy2l4LGoh1aFRZKaQ7.jpg
6024,Police Squad!,"In this cult parody of cop dramas, replete with farce and sight gags, Lieutenant Frank Drebin and his fellow officers from Police Squad bungle their way though crime investigations.",/Aqe4AEkVOHyt942WnyGYhiglUdT.jpg
105177,Unsolved Mysteries,"Real cases of perplexing disappearances, shocking murders and paranormal encounters fuel this gripping revival of the iconic documentary series.",/a97V0nC9IVtidZAFOx7VrBT0IWW.jpg
80006,Good Trouble,"After moving to The Coterie in Downtown Los Angeles, Callie and Mariana Foster realize that living on their own is not all that it’s cracked up to be.",/b9OwPQZr4dVv7K8SrUbAYJ35uLg.jpg
54583,Los heroes del norte,,/77CXvgDq4vO4oMUbIMVeqCylgpV.jpg
42503,Deadman Wonderland,"Ganta is the only survivor after a mysterious man in red slaughters a classroom full of teenagers. He's framed for the carnage, sentenced to die, and locked away in the most twisted prison ever built: Deadman Wonderland. And then it gets worse.",/m12JbXsDdB35RGAC1g3ImNQT4h5.jpg
34408,Mischievous Kiss,"A clumsy high-school girl - Oh Ha-ni - is at the bottom of her class, and she has had a crush on a popular genius, Baek Seung-Jo, ever since she first laid eyes on him.",/mSjKpNVYGxOL17vcEbQ0nzYjOH2.jpg
38693,Ninjago: Masters of Spinjitzu,"When the fate of their world, Ninjago, is challenged by great threats, it's up to the ninja: Kai, Jay, Cole, Zane, Lloyd and Nya to save the world.",/fqb9X4th2p2voefRLqdv1xoZQmC.jpg
19818,Pedro El Escamoso,"Pedro el escamoso is a popular telenovela filmed in Colombia and produced by the Colombian network, Caracol TV.

This novela is about a cheesy but charming macho man who lives in a small town in Colombia. He moves to the city to find his fortune and encounters a series of events and people that change his life dramatically. Pedro is the epitome of a man who can get all the women he wants, but can't get the one he loves.",/pAkYo3o2CQSHTGleUkutr0lylKS.jpg
1447,Psych,"Thanks to his police officer father's efforts, Shawn Spencer spent his childhood developing a keen eye for detail (and a lasting dislike of his dad). Years later, Shawn's frequent tips to the police lead to him being falsely accused of a crime he solved. Now, Shawn has no choice but to use his abilities to perpetuate his cover story: psychic crime-solving powers, all the while dragging his best friend, his dad, and the police along for the ride.",/fDI15gTVbtW5Sbv5QenqecRxWKJ.jpg
96346,Luna Nera,"In 17th-century Italy, a teenager learns about her destiny among a family of witches, just as her boyfriend's father hunts her down for witchcraft.",/ukAWA52fqoNSfkbbNB3XkKqsycz.jpg
72350,DuckTales,"The adventures of billionaire Scrooge McDuck and his nephews Huey, Dewey and Louie, their famous uncle Donald Duck, pilot extraordinaire Launchpad, Mrs. Beakly, Webby and Roboduck. Adventures and hidden treasures are everywhere, in their hometown Duckburg and all around the world.",/mBXPGrYd9wEzk7jpi5GkZJNDzZf.jpg
58539,Wild at Heart,"Corazón indomable is a Mexican telenovela produced by Nathalie Lartilleux for Televisa. It is a remake of Marimar, produced in 1994, and starring Thalía and Eduardo Capetillo.

Ana Brenda Contreras and Daniel Arenas star as the protagonists, while Ingrid Martz, Elizabeth Álvarez, Carlos de la Mota and René Strickler star as the antagonists.",/92oVOfEUgDti2UJvCaVAS9QbG7U.jpg
67773,Dirk Gently's Holistic Detective Agency,A comedic thriller that follows the bizarre adventures of eccentric “holistic” detective Dirk Gently and his reluctant assistant Todd. An adaptation of Douglas Adams’ wildly successful comic novels.,/q8oMpXPEAUJJ0KztsRs5K51T2lo.jpg
60735,The Flash,"After a particle accelerator causes a freak storm, CSI Investigator Barry Allen is struck by lightning and falls into a coma. Months later he awakens with the power of super speed, granting him the ability to move through Central City like an unseen guardian angel. Though initially excited by his newfound powers, Barry is shocked to discover he is not the only ""meta-human"" who was created in the wake of the accelerator explosion -- and not everyone is using their new powers for good. Barry partners with S.T.A.R. Labs and dedicates his life to protect the innocent. For now, only a few close friends and associates know that Barry is literally the fastest man alive, but it won't be long before the world learns what Barry Allen has become...The Flash.",/lJA2RCMfsWoskqlQhXPSLFQGXEJ.jpg
127865,The Chestnut Man,"At a grisly murder scene sits a figurine made of chestnuts. From this creepy clue, two detectives hunt a killer linked to a politician's missing child.",/tdLJTZJ184PsO9QkK9aPeeAXLlo.jpg
2673,The O.C.,"Ryan Atwood, a teen from the wrong side of the tracks, moves in with a wealthy family willing to give him a chance. But Ryan's arrival disturbs the status quo of the affluent, privileged community of Newport Beach, California.",/xDc6BMGDaeyalpSZ9KKk7RCBCz5.jpg
4344,Rescue Me,"Rescue Me revolves around the lives of the men in a New York City firehouse, the crew of 62 Truck. Examining the fraternal nature and relationships of firefighters, the series tackles the daily drama of the life-and-death situations associated with being a firefighter, while exploring the ways the men use dark humor to protect their true emotions.",/gnOwOb82chSJkQEZ9pd6jf2ZrEX.jpg
83596,Amar a Muerte,,/sdBP4fFzHqxaROw7h4OWCuvrHmv.jpg
48462,The Heirs,"Heirs follows a group of privileged, elite high school students as they are groomed to take over their families' business empires. These wealthy students seem to have everything under control–except their love lives. Kim Tan is heir to the Empire Group sent to study abroad in the U.S. In reality it's a form of exile, as his elder half-brother back home schemes to takes over the family business. While in the States, Kim Tan bumps into Cha Eun Sung, who's arrived from Korea in search of her older sister. He feels himself falling for her, never realizing that she's the daughter of his family's housekeeper. When his fiancée Rachel Yoo arrives to bring him back to Korea, his heart is torn between love and duty. Meanwhile, Rachel's half-brother Choi Young Do develops his own crush on Eun Sung. Who said being a rich, beautiful high school student was easy?",/n4RX9QVXjHbMB31TDWqqRLjshgu.jpg
78122,Saint Seiya: Saintia Sho,"The whole Sanctuary was misled into danger due to the civil war instigated by the Gemini Gold Saint, Saga. Our story begins right after the end of those events... This is a story of the girls protecting Athena. These are the records of love and fierce fights they meet while opposing destiny on their way to maturity...",/nCVE9TWt0ku2B3JnFATKkEeeuKK.jpg
70128,Genius,"The life stories of history's greatest minds. From their days as young adults to their final years we see their discoveries, loves, relationships, causes, flaws and genius.",/htTLjpN8FqWdByyFvlcoqIf2wzf.jpg
3797,Life,"Complex, offbeat Detective Charlie Crews returns to the force after serving time in prison for a crime he didn’t commit. Crews’ new lease on life has provided him with a Zen-like outlook, peace of mind and no need for vengeance, an attitude which can be challenging to maintain when someone he cares about is threatened — or when he is investigating the mystery surrounding the murder he was falsely accused of.",/4zTDeRJxdMqH3Si2fIZjQi44k17.jpg
105288,Down to Earth with Zac Efron,"Actor Zac Efron journeys around the world with wellness expert Darin Olien in a travel show that explores healthy, sustainable ways to live.",/eGGHsfDkZXek0qGJ1wsuoVzHEOh.jpg
73467,Godless,"A ruthless outlaw terrorizes the West in search of a former member of his gang, who’s found a new life in a quiet town populated only by women.",/ePOD0ofGWFDTbZR84QhM7kpYMPX.jpg
2693,Extras,"Andy Millman gave up his day job five years ago in the hope of achieving the big time, but he’s yet to land a speaking part, let alone saunter down the red carpet to pick up an Oscar. He remains optimistic however, as rubbing shoulders with the A-list on-set only serves to reinforce his belief that the big time is just a job or two away.",/zV4Xpdkk6IrGk2mnhrKdtQOHj4I.jpg
95356,Matchday: Inside FC Barcelona,"Inside FC Barcelona, which follows the famed soccer club through its 2018-2019 season.",/dHB3uysBq2hiyDmkYKrH7QqVXAR.jpg
94536,Hernán,"The Spanish ""Conquistador"" Hernán Cortés arrives in the shores of what today is México and faces both local demons and those who've sailed with him.",/adJ2jnpz77ai4coQqNzzBQ0OiXN.jpg
62490,El Negocio,"Karin, Magali and Luna are three call girls, who decide to apply some marketing knowledge on the world's oldest profession.",/mgPG7iWLy3IFUNj4BSLqxB1D6JH.jpg
19253,Mazinger Z,"Mazinger Z, known briefly as Tranzor Z in the United States, is a Japanese super robot manga series written and illustrated by Go Nagai. The first manga version was serialized in Shueisha's Weekly Shōnen Jump from October 1972 to August 1973, and it later continued in Kodansha TV Magazine from October 1973 to September 1974. It was adapted into an anime television series which aired on Fuji TV from December 1972 to September 1974. A second manga series was released alongside the TV show, this one drawn by Gosaku Ota, which started and ended almost at the same time of the TV show. Mazinger Z has spawned several sequels and spinoff series, among them UFO Robot Grendizer and Mazinkaiser. It was a very popular cartoon in Mexico during the 1980s, where it was dubbed into Spanish directly from the Japanese version, keeping the Japanese character names and broadcasting all 92 episodes, unlike the version aired in the U.S.",/woGUtAdRwjzWgobGvF3ebW1WsKY.jpg
8962,3000 Leagues in Search of Mother,"Italy is in a deep depression, so to support her family, Marco's  mother goes to Argentina to work as a domestic. But after she writes to  her family that she is sick, her letters stop coming. So Marco decides  to go to Argentina to look for her. He travels across Argentina to find  her, meeting many wonderful people, and having many adventures during  his journey.",/cNyYHaHxOytT7DFbVhRrHpkqlst.jpg
94703,Bronco The Series,"This is the story of José Guadalupe Esparza and his three friends, and how they became one of the most successful regional music bands in México: Bronco. Together, they will fight the music industry establishment, escaping poverty and facing discrimination. After years of great and hard work, they managed to sell out their good-bye show at the Azteca Stadium in 1997, with over 30 million records sold all over the region.",/uWf4Yrnr17CHwJjhAOcMgVdv7Cj.jpg
46671,The Future Diary,"Reality quickly unravels when antisocial Yukiteru is called into a death match against 11 other mentally scarred individuals. Each player has a prophetic device tuned to their personality, giving them control over their future—and the fate of their foes.",/eQBO8pyuch83TonVJc2NMFv7W8U.jpg
4605,The Suite Life of Zack & Cody,"Meet Zack and Cody, 11 year-old identical twins and the newest residents of Boston's swanky Tipton Hotel. Living in a suite with their mom Carey, the boys treat the tipton like their own personal playground.",/vKOdc6fWHaSTsVjUALFm5S4Vup0.jpg
4620,Eureka,"The sleepy Pacific Northwest town of Eureka is hiding a mysterious secret. The government has been relocating the world's geniuses and their families to this rustic town for years where innovation and chaos have lived hand in hand. U.S. Marshal Jack Carter stumbles upon this odd town after wrecking his car and becoming stranded there. When the denizens of the town unleash an unknown scientific creation, Carter jumps in to try to restore order and consequently learns of one of the country's best kept secrets.",/f2l5hUk63hPqYTucnFy2HmElFV0.jpg
68183,The Hours of My Life,"Your whole outlook on life can change in an instant. Takuto Sawada (Haruma Miura) is your average college student. But one day, he finds out that he has ALS (Lou Gehrig's disease) and only has a short time to live. How will he choose to spend the remaining days of his precious life?",/jZTtpReJhpntlgE08gGf5u0Q7G2.jpg
88396,The Falcon and the Winter Soldier,"Following the events of “Avengers: Endgame”, the Falcon, Sam Wilson and the Winter Soldier, Bucky Barnes team up in a global adventure that tests their abilities, and their patience.",/6kbAMLteGO8yyewYau6bJ683sw7.jpg
88061,"Hensuki: Are You Willing to Fall in Love With a Pervert, As Long As She's a Cutie?","A high school student whose years of not having a girlfriend is his age, Keiki Kiryuu, suddenly receives a love letter. He is happy he can finally have a girlfriend, but is also surprised because not only is there no sender name but also included is white underwear…??? The cute girls who gather around him are all weird and with reasons!? Who is the Cinderella who sent the underwear?",/qH5G6K09CWWgmiP3JCZK7UAkotW.jpg
7311,Nuevo Rico Nuevo Pobre,"Nuevo Rico Nuevo Pobre is a Colombian telenovela produced and broadcast by Caracol TV starring Martín Karpan, John Alex Toro, Maria Cecilia Botero, Carolina Acevedo, Hugo Gómez, former Miss Colombia Andrea Noceti and Andrés Toro.

The show started on July 16, 2007 on Caracol TV and it is also broadcast on Ecuador's Teleamazonas in primetime. Caracol TV has sold the rights of the show to Telemundo and Fox. It is, as of May 2008, one of the highest rated TV shows in Colombia.",/rqkZi3rcReCJ3zbJl4OUOsJrqh7.jpg
81559,V Wars,"After a mysterious disease begins transforming people into vampires, Dr. Luther Swann is pitted against his best friend, now a powerful vampire leader.",/njOxOfBp0d7DgdrMnOH1VugC9yZ.jpg
71722,Deception,"Cameron Black is the world's greatest illusionist. At least, that's what people used to call him—before his greatest secret was exposed and his career destroyed. Even worse, Cameron has good reason to believe this was no accident.",/fRQ3JV67ADyTrRNyXqefqJkJsD4.jpg
68421,Altered Carbon,"After 250 years on ice, a prisoner returns to life in a new body with one chance to win his freedom: by solving a mind-bending murder.",/95IsiH4p5937YXQHaOS2W2dWYOG.jpg
79593,Magnum P.I.,"Thomas Magnum, a decorated former Navy SEAL who, upon returning home from Afghanistan, repurposes his military skills to become a private investigator in Hawaii taking jobs no one else will with the help of fellow vets T.C. Calvin and Rick Wright, and the former MI:6 agent Higgins.",/wDdiwHqmYN24dXfN7zzDd275NDF.jpg
56296,Orphan Black,A streetwise hustler is pulled into a compelling conspiracy after witnessing the suicide of a girl who looks just like her.,/yET48smELUDAszOhHbL9A8RF3N8.jpg
2228,Pinky and the Brain,"Pinky and Brain are genetically enhanced laboratory mice who reside in a cage in the Acme Labs research facility. Brain is self-centered and scheming; Pinky is good-natured but feebleminded. In each episode, Brain devises a new plan to take over the world, which ultimately ends in failure, usually due to Pinky's idiocy, the impossibility of Brain's plan, Brain's own arrogance, or just circumstances beyond their control.",/Aj0UgPAjPgF0gtPSBLfQ3Bd77eG.jpg
1418,The Big Bang Theory,"The sitcom is centered on five characters living in Pasadena, California: roommates Leonard Hofstadter and Sheldon Cooper; Penny, a waitress and aspiring actress who lives across the hall; and Leonard and Sheldon's equally geeky and socially awkward friends and co-workers, mechanical engineer Howard Wolowitz and astrophysicist Raj Koothrappali. The geekiness and intellect of the four guys is contrasted for comic effect with Penny's social skills and common sense.",/ooBGRQBdbGzBxAVfExiO8r7kloA.jpg
43901,Longmire,A Wyoming sheriff rebuilds his life and career following the death of his wife. Based on the “Walt Longmire” series of mystery novels written by best-selling author Craig Johnson.,/dL0S96lnRDWauoyhTQi6jVHdvx0.jpg
72787,Patrick Melrose,"A critical and often humorous look at the upper class, tracking the protagonist’s harrowing odyssey from a deeply traumatic childhood through adult substance abuse and, ultimately, toward recovery.",/t6ubZ1Bpu0elTzA8tT2mxkrfpxA.jpg
63109,Moses and the Ten Commandments,"The story begins in the city of Pi-Ramesses, in Egypt, at approximately 1300 B.C, when the powerful pharaoh Seti, orders the death of every male newborn in his hatred of the Hebrew people. Amidst the horrors of mass infanticide, one brave Hebrew family defies Pharaoh`s command and hides their child in a basket set afloat on the river Nile, trusting that God would carry him to safety.",/fQRLMWx39G3SBZSq8kVZ18bezBs.jpg
76130,Killing Bites,,/uyIowoKd2SGu3ahUs669QuLFHbF.jpg
60866,iZombie,"A medical student who becomes a zombie joins a Coroner's Office in order to gain access to the brains she must reluctantly eat so that she can maintain her humanity. But every brain she eats, she also inherits their memories and must now solve their deaths with help from the Medical examiner and a police detective.",/q4nqNwAhzVR7JuYctrWJvUWz3xR.jpg
33987,Corazon Valiente,"Angela and Samantha were best friends when they were little, but a trap of fate separated them for many years. An unmissable story of loyalty, friendship, courage and love.",/4YWuiRyqnfalauuFC06S5yw92gH.jpg
3845,Happy Days,"In 1950s Milwaukee the Cunningham family must contend with Fonzie, a motorcycle riding Casanova.",/Tts7M6f5KzEwa8OXD931w8ET0e.jpg
136322,Dragons: The Nine Realms,"Set 1,300 years after the events of How to Train Your Dragon, dragons are now just a legend to the modern world. When a geological anomaly opens an immense, miles-deep fissure in the Earth’s surface, scientists from all over the world gather at a new research facility to study the mysterious phenomenon. Soon a group of misfit kids, brought to the site by their parents, uncover the truth about dragons and where they’ve been hiding -- a secret they must keep to themselves to protect what they’ve discovered.",/mCoQen8uLlW6VR2HhJfP4Xr4Osw.jpg
40351,Green Lantern: The Animated Series,The Green Lanterns Hal and his partner Kilowog fight against the forces of the Red Lanterns.,/qSSFP3va0q2WL2a2DzcdcjVe463.jpg
2875,MacGyver,"Angus MacGyver works as a troubleshooter for the Phoenix Foundation in Los Angeles and as an agent for a United States government agency, the Department of External Services. Educated as a scientist, MacGyer served as a Bomb Team Technician/EOD during the Vietnam War. Resourceful and possessed of an encyclopedic knowledge of the physical sciences, he solves complex problems with everyday materials he finds at hand, along with his ever-present duct tape and Swiss Army knife. He prefers non-violent resolutions and prefers not to handle a gun, but will if necessary.",/z0BJtmbcpkNDHEtiBpMGkMffbV9.jpg
1830,Tiny Toon Adventures,Follow the adventures of a group of young cartoon characters who attend the Acme Looniversity to become the next generation of characters from the Looney Tunes series.,/kK5ie5KRk8z70fOzeQepKsmf9z0.jpg
2973,Life on Mars,"A detective chief inspector from 2006 is investigating a serial killer when he is knocked over by a speeding car. Waking up, he finds himself mysteriously transported back in time to 1973. Initially struggling to come to terms with his situation, he has to come to terms with the old-fashioned technology and attitude of the day, while figuring out how he came to be trapped in the past.",/eoZzXx2DW8XeaIS8iYs0ePxH3DG.jpg
2942,The Tudors,"The Tudors is a history-based drama series following the young, vibrant King Henry VIII, a competitive and lustful monarch who navigates the intrigues of the English court and the human heart with equal vigor and justifiable suspicion.",/1ohemLJzAzDcO3aJXb0k46FiCx9.jpg
